{
  "version": 1,
  "playlist_version": "local-demo-20260608-002",
  "updatedAt": "2026-06-08T00:00:00.000Z",
  "items": [
    {
      "id": "anshin-wide",
      "item_id": "anshin-wide",
      "name": "安心お宿 3面ワイド",
      "enabled": true,
      "layout": "wide",
      "duration": 10,
      "start": "",
      "end": "",
      "days_of_week": [],
      "campaign_id": "anshin-oyado-demo",
      "asset_id": "anshin-wide",
      "priority": 0,
      "left": "",
      "center": "",
      "right": "",
      "wide": "/demo/industry.html?industry=anshin-oyado&scene=wide&zone=wide"
    },
    {
      "id": "anshin-guide",
      "item_id": "anshin-guide",
      "name": "安心お宿 館内案内",
      "enabled": true,
      "layout": "three-zone",
      "duration": 12,
      "start": "",
      "end": "",
      "days_of_week": [],
      "campaign_id": "anshin-oyado-demo",
      "asset_id": "anshin-guide",
      "priority": 0,
      "left": "/demo/industry.html?industry=anshin-oyado&scene=guide&zone=left",
      "center": "/demo/industry.html?industry=anshin-oyado&scene=guide&zone=center",
      "right": "/demo/industry.html?industry=anshin-oyado&scene=guide&zone=right",
      "wide": ""
    },
    {
      "id": "anshin-sauna",
      "item_id": "anshin-sauna",
      "name": "安心お宿 サウナ/休憩訴求",
      "enabled": true,
      "layout": "three-zone",
      "duration": 12,
      "start": "",
      "end": "",
      "days_of_week": [],
      "campaign_id": "anshin-oyado-demo",
      "asset_id": "anshin-sauna",
      "priority": 0,
      "left": "/demo/industry.html?industry=anshin-oyado&scene=sauna&zone=left",
      "center": "/demo/industry.html?industry=anshin-oyado&scene=sauna&zone=center",
      "right": "/demo/industry.html?industry=anshin-oyado&scene=sauna&zone=right",
      "wide": ""
    },
    {
      "id": "anshin-localads",
      "item_id": "anshin-localads",
      "name": "安心お宿 近隣広告枠",
      "enabled": true,
      "layout": "three-zone",
      "duration": 12,
      "start": "",
      "end": "",
      "days_of_week": [],
      "campaign_id": "anshin-oyado-demo",
      "asset_id": "anshin-localads",
      "priority": 0,
      "left": "/demo/industry.html?industry=anshin-oyado&scene=localads&zone=left",
      "center": "/demo/industry.html?industry=anshin-oyado&scene=localads&zone=center",
      "right": "/demo/industry.html?industry=anshin-oyado&scene=localads&zone=right",
      "wide": ""
    },
    {
      "id": "anshin-qr",
      "item_id": "anshin-qr",
      "name": "安心お宿 QRサンプル",
      "enabled": true,
      "layout": "three-zone",
      "duration": 12,
      "start": "",
      "end": "",
      "days_of_week": [],
      "campaign_id": "anshin-oyado-demo",
      "asset_id": "anshin-qr",
      "priority": 0,
      "left": "/demo/industry.html?industry=anshin-oyado&scene=qr&zone=left",
      "center": "/demo/industry.html?industry=anshin-oyado&scene=qr&zone=center",
      "right": "/demo/industry.html?industry=anshin-oyado&scene=qr&zone=right",
      "wide": ""
    },
    {
      "id": "balian-wide",
      "item_id": "balian-wide",
      "name": "バリアン 3面ワイド",
      "enabled": true,
      "layout": "wide",
      "duration": 10,
      "start": "",
      "end": "",
      "days_of_week": [],
      "campaign_id": "balian-demo",
      "asset_id": "balian-wide",
      "priority": 0,
      "left": "",
      "center": "",
      "right": "",
      "wide": "/demo/industry.html?industry=balian&scene=wide&zone=wide"
    },
    {
      "id": "balian-roomservice",
      "item_id": "balian-roomservice",
      "name": "バリアン ルームサービス訴求",
      "enabled": true,
      "layout": "three-zone",
      "duration": 12,
      "start": "",
      "end": "",
      "days_of_week": [],
      "campaign_id": "balian-demo",
      "asset_id": "balian-roomservice",
      "priority": 0,
      "left": "/demo/industry.html?industry=balian&scene=roomservice&zone=left",
      "center": "/demo/industry.html?industry=balian&scene=roomservice&zone=center",
      "right": "/demo/industry.html?industry=balian&scene=roomservice&zone=right",
      "wide": ""
    },
    {
      "id": "balian-anniversary",
      "item_id": "balian-anniversary",
      "name": "バリアン 記念日プラン訴求",
      "enabled": true,
      "layout": "three-zone",
      "duration": 12,
      "start": "",
      "end": "",
      "days_of_week": [],
      "campaign_id": "balian-demo",
      "asset_id": "balian-anniversary",
      "priority": 0,
      "left": "/demo/industry.html?industry=balian&scene=anniversary&zone=left",
      "center": "/demo/industry.html?industry=balian&scene=anniversary&zone=center",
      "right": "/demo/industry.html?industry=balian&scene=anniversary&zone=right",
      "wide": ""
    },
    {
      "id": "balian-amenity",
      "item_id": "balian-amenity",
      "name": "バリアン アメニティ案内",
      "enabled": true,
      "layout": "three-zone",
      "duration": 12,
      "start": "",
      "end": "",
      "days_of_week": [],
      "campaign_id": "balian-demo",
      "asset_id": "balian-amenity",
      "priority": 0,
      "left": "/demo/industry.html?industry=balian&scene=amenity&zone=left",
      "center": "/demo/industry.html?industry=balian&scene=amenity&zone=center",
      "right": "/demo/industry.html?industry=balian&scene=amenity&zone=right",
      "wide": ""
    },
    {
      "id": "balian-reservation",
      "item_id": "balian-reservation",
      "name": "バリアン 予約導線QR",
      "enabled": true,
      "layout": "three-zone",
      "duration": 12,
      "start": "",
      "end": "",
      "days_of_week": [],
      "campaign_id": "balian-demo",
      "asset_id": "balian-reservation",
      "priority": 0,
      "left": "/demo/industry.html?industry=balian&scene=reservation&zone=left",
      "center": "/demo/industry.html?industry=balian&scene=reservation&zone=center",
      "right": "/demo/industry.html?industry=balian&scene=reservation&zone=right",
      "wide": ""
    },
    {
      "id": "pasela-wide",
      "item_id": "pasela-wide",
      "name": "パセラ 3面ワイド",
      "enabled": true,
      "layout": "wide",
      "duration": 10,
      "start": "",
      "end": "",
      "days_of_week": [],
      "campaign_id": "pasela-demo",
      "asset_id": "pasela-wide",
      "priority": 0,
      "left": "",
      "center": "",
      "right": "",
      "wide": "/demo/industry.html?industry=pasela&scene=wide&zone=wide"
    },
    {
      "id": "pasela-food",
      "item_id": "pasela-food",
      "name": "パセラ フード/ドリンク訴求",
      "enabled": true,
      "layout": "three-zone",
      "duration": 12,
      "start": "",
      "end": "",
      "days_of_week": [],
      "campaign_id": "pasela-demo",
      "asset_id": "pasela-food",
      "priority": 0,
      "left": "/demo/industry.html?industry=pasela&scene=food&zone=left",
      "center": "/demo/industry.html?industry=pasela&scene=food&zone=center",
      "right": "/demo/industry.html?industry=pasela&scene=food&zone=right",
      "wide": ""
    },
    {
      "id": "pasela-collab",
      "item_id": "pasela-collab",
      "name": "パセラ コラボ告知",
      "enabled": true,
      "layout": "three-zone",
      "duration": 12,
      "start": "",
      "end": "",
      "days_of_week": [],
      "campaign_id": "pasela-demo",
      "asset_id": "pasela-collab",
      "priority": 0,
      "left": "/demo/industry.html?industry=pasela&scene=collab&zone=left",
      "center": "/demo/industry.html?industry=pasela&scene=collab&zone=center",
      "right": "/demo/industry.html?industry=pasela&scene=collab&zone=right",
      "wide": ""
    },
    {
      "id": "pasela-event",
      "item_id": "pasela-event",
      "name": "パセラ イベント案内",
      "enabled": true,
      "layout": "three-zone",
      "duration": 12,
      "start": "",
      "end": "",
      "days_of_week": [],
      "campaign_id": "pasela-demo",
      "asset_id": "pasela-event",
      "priority": 0,
      "left": "/demo/industry.html?industry=pasela&scene=event&zone=left",
      "center": "/demo/industry.html?industry=pasela&scene=event&zone=center",
      "right": "/demo/industry.html?industry=pasela&scene=event&zone=right",
      "wide": ""
    },
    {
      "id": "pasela-tour",
      "item_id": "pasela-tour",
      "name": "パセラ 回遊導線QR",
      "enabled": true,
      "layout": "three-zone",
      "duration": 12,
      "start": "",
      "end": "",
      "days_of_week": [],
      "campaign_id": "pasela-demo",
      "asset_id": "pasela-tour",
      "priority": 0,
      "left": "/demo/industry.html?industry=pasela&scene=tour&zone=left",
      "center": "/demo/industry.html?industry=pasela&scene=tour&zone=center",
      "right": "/demo/industry.html?industry=pasela&scene=tour&zone=right",
      "wide": ""
    },
    {
      "id": "vision-wide",
      "item_id": "vision-wide",
      "name": "ビジョンセンター 3面ワイド",
      "enabled": true,
      "layout": "wide",
      "duration": 10,
      "start": "",
      "end": "",
      "days_of_week": [],
      "campaign_id": "vision-center-demo",
      "asset_id": "vision-wide",
      "priority": 0,
      "left": "",
      "center": "",
      "right": "",
      "wide": "/demo/industry.html?industry=vision-center&scene=wide&zone=wide"
    },
    {
      "id": "vision-guide",
      "item_id": "vision-guide",
      "name": "ビジョンセンター 会場案内",
      "enabled": true,
      "layout": "three-zone",
      "duration": 12,
      "start": "",
      "end": "",
      "days_of_week": [],
      "campaign_id": "vision-center-demo",
      "asset_id": "vision-guide",
      "priority": 0,
      "left": "/demo/industry.html?industry=vision-center&scene=guide&zone=left",
      "center": "/demo/industry.html?industry=vision-center&scene=guide&zone=center",
      "right": "/demo/industry.html?industry=vision-center&scene=guide&zone=right",
      "wide": ""
    },
    {
      "id": "vision-streaming",
      "item_id": "vision-streaming",
      "name": "ビジョンセンター 配信パック訴求",
      "enabled": true,
      "layout": "three-zone",
      "duration": 12,
      "start": "",
      "end": "",
      "days_of_week": [],